artist,song,link,text
ABBA,Ahe's My Kind Of Girl,/a/abba/ahes+my+kind+of+girl_20598417.html,"Look at her face, it's a wonderful face  
And it means something special to me  
Look at the way that she smiles when she sees me  
How lucky can one fellow be?  
  
She's just my kind of girl, she makes me feel fine  
Who could ever believe that she could be mine?  
She's just my kind of girl, without her I'm blue  
And if she ever leaves me what could I do, what could I do?  
  
And when we go for a walk in the park  
And she holds me and squeezes my hand  
We'll go on walking for hours and talking  
About all the things that we plan  
  
She's just my kind of girl, she makes me feel fine  
Who could ever believe that she could be mine?  
She's just my kind of girl, without her I'm blue  
And if she ever leaves me what could I do, what could I do?

"
ABBA,"Andante, Andante",/a/abba/andante+andante_20002708.html,"Take it easy with me, please  
Touch me gently like a summer evening breeze  
Take your time, make it slow  
Andante, Andante  
Just let the feeling grow  
  
Make your fingers soft and light  
Let your body be the velvet of the night  
Touch my soul, you know how  
Andante, Andante  
Go slowly with me now  
  
I'm your music  
(I am your music and I am your song)  
I'm your song  
(I am your music and I am your song)  
Play me time and time again and make me strong  
(Play me again 'cause you're making me strong)  
Make me sing, make me sound  
(You make me sing and you make me)  
Andante, Andante  
Tread lightly on my ground  
Andante, Andante  
Oh please don't let me down  
  
There's a shimmer in your eyes  
Like the feeling of a thousand butterflies  
Please don't talk, go on, play  
Andante, Andante  
And let me float away  
  
I'm your music  
(I am your music and I am your song)  
I'm your song  
(I am your music and I am your song)  
Play me time and time again and make me strong  
(Play me again 'cause you're making me strong)  
Make me sing, make me sound  
(You make me sing and you make me)  
Andante, Andante  
Tread lightly on my ground  
Andante, Andante  
Oh please don't let me down  
  
Make me sing, make me sound  
(You make me sing and you make me)  
Andante, Andante  
Tread lightly on my ground  
Andante, Andante  
Oh please don't let me down  
Andante, Andante  
Oh please don't let me down

"
ABBA,As Good As New,/a/abba/as+good+as+new_20003033.html,"I'll never know why I had to go  
Why I had to put up such a lousy rotten show  
Boy, I was tough, packing all my stuff  
Saying I don't need you anymore, I've had enough  
And now, look at me standing here again 'cause I found out that  
Ma ma ma ma ma ma ma ma ma ma ma ma ma ma ma ma my life is here  
Gotta have you near  
  
As good as new, my love for you  
And keeping it that way is my intention  
As good as new and growing too  
Yes, I think it's taking on a new dimension  
It's as good as new, my love for you  
Just like it used to be and even better  
As good as new, thank God it's true  
Darling, we were always meant to stay together  
  
Feel like a creep, never felt so cheap  
Never had a notion that my love could be so deep  
How could I make such a dumb mistake  
Now I know I'm not entitled to another break  
But please, baby, I beg you to forgive 'cause I found out that  
Ma ma ma ma ma ma ma ma ma ma ma ma ma ma ma ma my life is here  
Gotta get you near  
  
I thought that our love was at an end but here I am again  
  
As good as new, my love for you  
And keeping it that way is my intention  
As good as new and growing too  
Yes, I think it's taking on a new dimension  
It's as good as new, my love for you  
Just like it used to be and even better  
As good as new, thank God it's true  
Darling, we were always meant to stay together  
  
Yes the love I have for you feels as good as new  
Darling, we were always meant to stay together

"
ABBA,Bang,/a/abba/bang_20598415.html,"Making somebody happy is a question of give and take  
You can learn how to show it so come on, give yourself a break  
Every smile and every little touch  
Don't you know that they mean so much  
Sweet sweet kisses so tender  
Always will return to sender  
  
Like a bang, a boom-a-boomerang  
Dum-be-dum-dum be-dum-be-dum-dum  
Oh bang, a boom-a-boomerang  
Love is a tune you hum-de-hum-hum  
So give it away, I think you'll learn  
You'll get love in return  
So bang, a boom-a-boomerang is love  
A boom-a-boomerang is love  
  
Love is always around and you can look for it anywhere  
When you feel that you've found it my advice is to take good care  
Never use it as a selfish tool  
Never ever be such a fool  
Every feeling you're showing  
Is a boomerang you're throwing  
  
Yes a bang, a boom-a-boomerang  
Dum-be-dum-dum be-dum-be-dum-dum  
Oh bang, a boom-a-boomerang  
Love is a tune you hum-de-hum-hum  
So give it away, I think you'll learn  
You'll get love in return  
So bang, a boom-a-boomerang is love  
  
And if you're warm and tender  
I'll kiss you, return to sender  
Please surrender  
  
Bang, a boom-a-boomerang  
Dum-be-dum-dum be-dum-be-dum-dum  
Oh bang, a boom-a-boomerang is love  
A boom-a-boomerang is love

"
ABBA,Bang-A-Boomerang,/a/abba/bang+a+boomerang_20002668.html,"Making somebody happy is a question of give and take  
You can learn how to show it so come on, give yourself a break  
Every smile and every little touch  
Don't you know that they mean so much  
Sweet sweet kisses so tender  
Always will return to sender  
  
Like a bang, a boom-a-boomerang  
Dumb-be-dumb-dumb be-dumb-be-dumb-dumb  
Oh bang, a boom-a-boomerang  
Love is a tune you hum-de-hum-hum  
By giving away, I think you'll learn  
You'll get love in return  
So bang, a boom-a-boomerang is love  
A boom-a-boomerang is love  
  
Love is always around and you can look for it anywhere  
When you feel that you've found it my advice is to take good care  
Never use it as a selfish tool  
Never ever be such a fool  
Every feeling you're showing  
Is a boomerang you're throwing  
  
Yes a bang, a boom-a-boomerang  
Dumb-be-dumb-dumb be-dumb-be-dumb-dumb  
Oh bang, a boom-a-boomerang  
Love is a tune you hum-de-hum-hum  
By giving away, I think you'll learn  
You'll get love in return  
So bang, a boom-a-boomerang is love  
  
And if you're warm and tender  
I'll kiss you, return to sender  
Please surrender  
  
Bang, a boom-a-boomerang  
Dumb-be-dumb-dumb be-dumb-be-dumb-dumb  
Oh bang, a boom-a-boomerang is love  
A boom-a-boomerang is love

"
ABBA,Burning My Bridges,/a/abba/burning+my+bridges_20003011.html,"Well, you hoot and you holler and you make me mad  
And I've always been under your heel  
Holy christ what a lousy deal  
Now I'm sick and tired of your tedious ways  
And I ain't gonna take it no more  
Oh no no - walkin' out that door  
  
Burning my bridges, cutting my tie  
Once again I wanna look into the eye  
Being myself  
Counting my pride  
No un-right neighbour's gonna take me for a ride  
Burning my bridges  
Moving at last  
Girl I'm leaving and I'm burying the past  
Gonna have peace now  
You can be free  
No one here will make a sucker out of me

"
ABBA,Cassandra,/a/abba/cassandra_20002811.html,"Down in the street they're all singing and shouting  
Staying alive though the city is dead  
Hiding their shame behind hollow laughter  
While you are crying alone on your bed  
  
Pity Cassandra that no one believed you  
But then again you were lost from the start  
Now we must suffer and sell our secrets  
Bargain, playing smart, aching in our hearts  
  
Sorry Cassandra I misunderstood  
Now the last day is dawning  
Some of us wanted but none of us would  
Listen to words of warning  
But on the darkest of nights  
Nobody knew how to fight  
And we were caught in our sleep  
Sorry Cassandra I didn't believe  
You really had the power  
I only saw it as dreams you would weave  
Until the final hour  
  
So in the morning your ship will be sailing  
Now that your father and sister are gone  
There is no reason for you to linger  
You're grieving deeply but still moving on  
  
You know the future is casting a shadow  
No one else sees it but you know your fate  
Packing your bags, being slow and thorough  
Knowing, though you're late, that ship is sure to wait  
  
Sorry Cassandra I misunderstood  
Now the last day is dawning  
Some of us wanted but none of us would  
Listen to words of warning  
But on the darkest of nights  
Nobody knew how to fight  
And we were caught in our sleep  
Sorry Cassandra I didn't believe  
You really had the power  
I only saw it as dreams you would weave  
Until the final hour  
  
I watched the ship leaving harbor at sunrise  
Sails almost slack in the cool morning rain  
She stood on deck, just a tiny figure  
Rigid and restrained, blue eyes filled with pain  
  
Sorry Cassandra I misunderstood  
Now the last day is dawning  
Some of us wanted but none of us would  
Listen to words of warning  
But on the darkest of nights  
Nobody knew how to fight  
And we were caught in our sleep  
Sorry Cassandra I didn't believe  
You really had the power  
I only saw it as dreams you would weave  
Until the final hour  
  
I'm sorry Cassandra  
I'm sorry Cassandra

"
ABBA,Chiquitita,/a/abba/chiquitita_20002978.html,"Chiquitita, tell me what's wrong  
You're enchained by your own sorrow  
In your eyes there is no hope for tomorrow  
How I hate to see you like this  
There is no way you can deny it  
I can see that you're oh so sad, so quiet  
  
Chiquitita, tell me the truth  
I'm a shoulder you can cry on  
Your best friend, I'm the one you must rely on  
You were always sure of yourself  
Now I see you've broken a feather  
I hope we can patch it up together  
  
Chiquitita, you and I know  
How the heartaches come and they go and the scars they're leaving  
You'll be dancing once again and the pain will end  
You will have no time for grieving  
Chiquitita, you and I cry  
But the sun is still in the sky and shining above you  
Let me hear you sing once more like you did before  
Sing a new song, Chiquitita  
Try once more like you did before  
Sing a new song, Chiquitita  
  
So the walls came tumbling down  
And your love's a blown out candle  
All is gone and it seems too hard to handle  
Chiquitita, tell me the truth  
There is no way you can deny it  
I see that you're oh so sad, so quiet  
  
Chiquitita, you and I know  
How the heartaches come and they go and the scars they're leaving  
You'll be dancing once again and the pain will end  
You will have no time for grieving  
Chiquitita, you and I cry  
But the sun is still in the sky and shining above you  
Let me hear you sing once more like you did before  
Sing a new song, Chiquitita  
Try once more like you did before  
Sing a new song, Chiquitita  
Try once more like you did before  
Sing a new song, Chiquitita

"
ABBA,Crazy World,/a/abba/crazy+world_20003013.html,"I was out with the morning sun  
Couldn't sleep, so I thought I'd take a walk  
I was thinking of you and me  
And I went to your house, 'cause I had to talk  
  
I could hardly believe my eyes  
When I saw this guy closing your front door  
Had the feeling of emptiness like I never had before  
And I closed my eyes, will you leave me girl  
  
Then I realized, it's a crazy world  
As he disapeared in his car  
I was stunned and I didn't know what to do  
Everything I had ever dreamed  
  
Everything in my life's part of you  
And I just couldn't move my feet  
So I stood on the pavement as you came out  
You acted as you didn't know what it was all about  
  
And I closed my eyes, will you leave me girl  
Then I realized, it's a crazy world  
Baby, how could you do it  
You just told me lies  
  
And you meet behind my back  
With other guys  
Baby, how could you tell me  
There was only me  
  
I was stupid to believe you  
I was blind but now I see  
Then you smiled and you took my hand  
""There is something"", you said, ""that you may not know  
  
There's a couple of men in my life  
And one of them is my brother Joe  
He's been gone for a long, long time  
But he's back and I think he's gonna stay  
  
You'll be seeing a lot of him, he's so nice in every way""  
Then I closed my eyes, never leave me girl  
Then I realized, it's a crazy world  
So I closed my eyes, never leave me girl  
  
Then I realized, it's a crazy world  
So I closed my eyes, never leave me girl  
Then I realized, it's a crazy world

"
ABBA,Crying Over You,/a/abba/crying+over+you_20177611.html,"I'm waitin' for you baby  
I'm sitting all alone  
I feel so cold without you  
It chills me to the bone  
I never thought you'd leave me  
But now I know it's true  
Oh Lord I'm blue  
I'm cryin' over you  
I'm waitin' for you baby  
I'm sittin' all alone  
I feel so cold without you  
It chills me to the bone  
I never thought you'd leave me  
But now I know it's true  
Oh Lord I'm blue  
I'm cryin' over you  
  
Cryin' over you  
I'm cryin' over you  
Cryin' over  
Little memories of things we used to do  
Oh Lord I'm blue  
I'm cryin' over you  
Oh Lord I'm blue  
I'm cryin' over you  
Oh Lord I'm blue  
I'm cryin' over you

"
ABBA,Dance,/a/abba/dance_10001507.html,"Oh, my love it makes me sad.  
Why did things turn out so bad?  
Was it just a dream, everything we did, everything we had?  
  
Baby, give me one more  
Dance while the music still goes on  
Don't think about tomorrow  
Dance and forget our time is gone  
Tonight's a night we borrow.  
Let's make it a memory, a night of our own  
A thing to remember when we're all alone  
So dance, it's our way to say goodbye  
  
Yes, all we have to do is  
Dance while the music still goes on  
This is no time for crying  
Dance, don't you hear them play our song  
God knows that we've been trying  
But we didn't make it 'cause nothing's the same  
We just couldn't help it, nobody's to blame  
So dance while the music still goes on  
And let it be our last goodbye  
  
Yet it seems to make me sad.  
Why did things turn out so bad?  
Was is just a dream, everything we did, everything we had?  
  
Baby, give me one last  
Dance while the music still goes on  
Just like the night I met you  
Dance and believe me, when you're gone  
You know I won't forget you  
Our love was a snowbird, it's flying away  
You tell me it's over, what more can I say?  
So dance while the music still goes on  
It's gonna be our last goodbye  
  
Dance while the music still goes on  
Don't think about tomorrow  
Dance and forget our time is gone  
Tonight's a night we borrow.  
Let's make it a memory, a night of our own  
A thing to remember when we're all alone  
So dance while the music still goes on  
And let it be our last goodbye  
  
Dance while the music still goes on  
This is no time for crying  
Dance, don't you hear them play our song  
God knows that we've been trying  
Dance while the music still goes on  
Just like the night I met you  
Dance and believe me, when you're gone  
You know I won't forget you  
  
(fade)

"
ABBA,Dancing Queen,/a/abba/dancing+queen_20002554.html,"You can dance, you can jive, having the time of your life  
See that girl, watch that scene, diggin' the Dancing Queen  
  
Friday night and the lights are low  
Looking out for the place to go  
Where they play the right music, getting in the swing  
You come in to look for a king  
Anybody could be that guy  
Night is young and the music's high  
With a bit of rock music, everything is fine  
You're in the mood for a dance  
And when you get the chance  
  
You are the Dancing Queen, young and sweet, only seventeen  
Dancing Queen, feel the beat from the tambourine  
You can dance, you can jive, having the time of your life  
See that girl, watch that scene, diggin' the Dancing Queen  
  
You're a teaser, you turn 'em on  
Leave them burning and then you're gone  
Looking out for another, anyone will do  
You're in the mood for a dance  
And when you get the chance  
  
You are the Dancing Queen, young and sweet, only seventeen  
Dancing Queen, feel the beat from the tambourine  
You can dance, you can jive, having the time of your life  
See that girl, watch that scene, diggin' the Dancing Queen

"
ABBA,Disillusion,/a/abba/disillusion_20002786.html,"Changing, moving in a circle  
I can see your face in all of my dreams  
Smiling, laughing from the shadows  
When I hear your voice, I know what it means  
I know it doesn't matter just how hard I try  
You're all the reason for my life  
  
Disillusion, disillusion's all you left for me  
How can I forget you when my world is breaking down  
You're all I had, you're all I want  
Disillusion, disillusions, now that's all I have  
  
Wishing, hoping, chasing shadows  
Did I see your face somewhere in the crowd  
Thinking, wondering what you're doing  
I can't stop myself from crying out loud  
They say my wound will heal and only leave a scar  
But then, they never shared our love  
  
Disillusion, disillusion's all you left for me  
How can I forget you when my world is breaking down  
You're all I had, you're all I want  
Disillusion, disillusions, now that's all I have  
  
Disillusion, disillusions, now that's all I have

"
ABBA,Does Your Mother Know,/a/abba/does+your+mother+know_20003035.html,"You're so hot, teasing me  
So you're blue but I can't take a chance on a chick like you  
That's something I couldn't do  
There's that look in your eyes  
I can read in your face that your feelings are driving you wild  
Ah, but girl you're only a child  
  
Well I can dance with you honey  
If you think it's funny  
Does your mother know that you're out?  
And I can chat with you baby  
Flirt a little maybe  
Does your mother know that you're out?  
  
Take it easy (take it easy)  
Better slow down girl  
That's no way to go  
Does your mother know?  
  
Take it easy (take it easy)  
Try to cool it girl  
Take it nice and slow  
Does your mother know?  
  
I can see what you want  
But you seem pretty young to be searching for that kind of fun  
So maybe I'm not the one  
Now you're so cute, I like your style  
And I know what you mean when you give me a flash of that smile (smile)  
But girl you're only a child  
  
Well I can dance with you honey  
If you think it's funny  
Does your mother know that you're out?  
And I can chat with you baby  
Flirt a little maybe  
Does your mother know that you're out?  
  
Take it easy (take it easy)  
Better slow down girl  
That's no way to go  
Does your mother know?  
  
Take it easy (take it easy)  
Try to cool it girl  
Take it nice and slow  
Does your mother know?  
  
Well I can dance with you honey  
If you think it's funny  
Does your mother know that you're out?  
And I can chat with you baby  
  
Flirt a little maybe  
Does your mother know that you're out?

"
ABBA,Dream World,/a/abba/dream+world_20003014.html,"Agnetha We're not the stars of a Hollywood movie  
So what's the use to pretend  
I'm not so charming and you're not so groovy  
You've got to face it my friend  
  
Agnetha, Frida Dreamworld, you've been living in a dreamworld  
Trust me, you just can't escape from reality  
Boy meets girl, doesn't mean they're in a dreamworld  
Here I am, here you are,  
  
We're gonna make it together  
And within, it's a fuss  
So we can only get better  
Agnetha When you reach up and you say to me  
  
How I love you, girl  
When I hold you, baby, can't you see  
That's the way we whirl  
You had your hopes and your high expectations  
  
Somehow it doesn't seem right  
I'm getting fed-up with your acquisitions  
I'm not your angel in white  
Agnetha, Frida Dreamworld, you've been living in a dreamworld  
  
Trust me, you just can't escape from reality  
Boy meets girl, doesn't mean they're in a dreamworld  
Here I am, here you are,  
We're gonna make it together  
  
And within, it's a fuss  
So we can only get better  
Agnetha When you reach up and you say to me  
How I love you, girl  
  
When I hold you, baby, can't you see  
That's the way we whirl  
Agnetha, Frida Dreamworld, you've been living in a dreamworld  
Trust me, you just can't escape from reality  
  
Boy meets girl, doesn't mean they're in a dreamworld  
Here I am, here you are,  
We're gonna make it together  
And within, it's a fuss  
  
So we can only get better

"
ABBA,Dum Dum Diddle,/a/abba/dum+dum+diddle_20002555.html,"I can hear how you work, practising hard  
Playing night and day, wo-oh  
And it sounds better now, yes you improve  
Everytime you play, wo-oh  
But it's bad  
You're so sad  
And you're only smiling  
When you play your violin  
  
Dumb dumb diddle, to be your fiddle  
To be so near you and not just hear you  
Dumb dumb diddle, to be your fiddle  
I think then maybe you'd see me, baby  
You'd be mine  
And we'd be together all the time  
Wish I was dumb dumb diddle, your darling fiddle  
  
But I think, you don't know that I exist  
I'm the quiet kind, wo-oh  
From the day when I first listened to you  
You've been on my mind, wo-oh  
You don't care  
It's not fair  
And you're only smiling  
When you play your violin  
  
Dumb dumb diddle, to be your fiddle  
To be so near you and not just hear you  
Dumb dumb diddle, to be your fiddle  
I think then maybe you'd see me, baby  
You'd be mine  
And we'd be together all the time  
  
Dumb dumb diddle, to be your fiddle  
To be so near you and not just hear you  
Dumb dumb diddle, to be your fiddle  
I think then maybe you'd see me, baby  
You'd be mine  
And we'd be together all the time  
Wish I was dumb dumb diddle, your darling find

"
ABBA,Eagle,/a/abba/eagle_20002818.html,"They came flying from far away, now I'm under their spell  
I love hearing the stories that they tell  
They've seen places beyond my land and they've found new horizons  
They speak strangely but I understand  
  
And I dream I'm an eagle  
And I dream I can spread my wings  
Flying high, high, I'm a bird in the sky  
I'm an eagle that rides on the breeze  
High, high, what a feeling to fly  
Over mountains and forests and seas  
And to go anywhere that I please  
  
As all good friends we talk all night, and we fly wing to wing  
I have questions and they know everything  
There's no limit to what I feel, we climb higher and higher  
Am I dreaming or is it all real?  
  
Is it true I'm an eagle?  
Is it true I can spread my wings?  
Flying high, high, I'm a bird in the sky (I'm an eagle)  
I'm an eagle that rides on the breeze  
High, high, what a feeling to fly (What a feeling)  
Over mountains and forests and seas  
And to go anywhere that I please

"
ABBA,Every Good Man,/a/abba/every+good+man_20336091.html,"Every good man needs a helping hand  
so I travel alone if I can  
Every man has a guiding star  
and he knows what he's gonna get  
when he's going too far  
  
Living on the dark side once again  
It's sad to lose a friend  
Looking at things with empty feelings  
Still we're going on  
  
For Every good man needs a helping hand  
I should have known too  
Some of us learn too late, I'm sorry  
Every good man needs a helping hand  
It's true  
  
Every good man needs a helping hand  
so I travel alone if I can  
Every man has a guiding star  
and he knows  
what he's gonna get  
when he's going too far  
  
Living on the dark side once again  
It's sad to lose a friend  
Looking at things with empty feelings  
Still we're going on  
  
For Every good man needs a helping hand  
I should have known too  
Some of us learn too late, I'm sorry  
Every good man needs a helping hand  
It's true

"
ABBA,Fernando,/a/abba/fernando_20002896.html,"Can you hear the drums Fernando?  
I remember long ago another starry night like this  
In the firelight Fernando  
You were humming to yourself and softly strumming your guitar  
I could hear the distant drums  
And sounds of bugle calls were coming from afar  
  
They were closer now Fernando  
Every hour every minute seemed to last eternally  
I was so afraid Fernando  
We were young and full of life and none of us prepared to die  
And I'm not ashamed to say  
The roar of guns and cannons almost made me cry  
  
There was something in the air that night  
The stars were bright, Fernando  
They were shining there for you and me  
For liberty, Fernando  
Though I never thought that we could lose  
There's no regret  
If I had to do the same again  
I would, my friend, Fernando  
If I had to do the same again  
I would, my friend, Fernando  
  
Now we're old and grey Fernando  
And since many years I haven't seen a rifle in your hand  
Can you hear the drums Fernando?  
Do you still recall the frightful night we crossed the Rio Grande?  
I can see it in your eyes  
How proud you were to fight for freedom in this land  
  
(Repeat x2)  
There was something in the air that night  
The stars were bright, Fernando  
They were shining there for you and me  
For liberty, Fernando  
Though I never thought that we could lose  
There's no regret  
If I had to do the same again  
I would, my friend, Fernando  
  
Yes, if I had to do the same again  
I would, my friend, Fernando...

"
